{ "name": "morfometria-albatros-laysan-guadalupe",
  "homepage": "https://bitbucket.org/IslasGECI/datos-texto/src/default/datapackage/morfometria-albatros-laysan-guadalupe/",
  "profile": "tabular-data-package",
  "contributors": [
    { "title": "Mariana Salinas",
      "email": "mariana.salinas@islas.org.mx",
      "organization": "GECI",
      "role": "author"
    },
    { "title": "Yutzil Lora",
      "email": "yutzil.lora@islas.org.mx",
      "organization": "GECI",
      "role": "contributor"
    },
    { "title": "David Martínez",
      "email": "david.martinez@islas.org.mx",
      "organization": "GECI",
      "role": "contributor"
    },
    { "title": "Efren Cabrera",
      "email": "efren.cabrera@islas.org.mx",
      "organization": "GECI",
      "role": "contributor"
    },
    { "title": "Braulio Rojas",
      "email": "braulio.rojas@islas.org.mx",
      "organization": "GECI",
      "role": "contributor"
    },
    { "title": "Haran Peiro-Nuño",
      "email": "hpeiro@uabc.edu.mx",
      "organization": "GECI",
      "role": "maintainer"
    }
  ],
  "description": "Morfometría de albatros de Laysan en Isla Guadalupe (2015-2018) para determinar el dimorfismo sexual de esta especie mediante regresión logística.",
  "institution": "Grupo de Ecología y Conservación de Islas",
  "sources": [
    { "title": "Julio Hernández Montoya",
      "email": "julio.montoya@islas.org.mx"
    }
  ],
  "resources": [
    { "name": "morfometria_albatros-laysan_guadalupe",
      "path": "morfometria_albatros-laysan_guadalupe.csv",
      "profile": "tabular-data-resource",
      "description": "Morfometría de albatros de Laysan en Isla Guadalupe (2015-2018)",
      "source": "Medidas in situ",
      "title": "Laysan Albatross morphometry from Guadalupe Island",
      "titulo": "Morfometría de Albatros de Laysan en Isla Guadalupe",
      "schema": {
        "fields": [
          { "name": "fecha",
            "description": "año en que se realizó el muestreo",
            "long_name": "Year",
            "nombre_largo": "Año",
            "axis": "T",
            "standard_name": "date",
            "type": "integer",
            "constraints": {"minumum": 2015}
          },
          { "name": "subcolonia",
            "description": "Subcolonia en que se realizó en monitoreo",
            "long_name": "Subcolony",
            "nombre_largo": "Subcolonia",
            "axis": "",
            "standard_name": "",
            "type": "string",
            "constraints": {"enum": ["Punta Sur", "Zapato", "Morro Prieto"]}
          },
          { "name": "nidoPS",
            "description": "Número del nido",
            "long_name": "Nest",
            "nombre_largo": "Nido",
            "axis": "",
            "standard_name": "",
            "type": "integer",
            "constraints": {"minumum": 1}
          },
          { "name": "darvic",
            "description": "Clave de indentificación del anillo de Darvic",
            "long_name": "Darvic",
            "nombre_largo": "Darvic",
            "axis": "",
            "standard_name": "",
            "type": "string"
          },
          { "name": "sexo",
            "description": "Sexo del individuo",
            "long_name": "Sex",
            "nombre_largo": "Sexo",
            "axis": "",
            "standard_name": "",
            "type": "string",
            "constraints": {"enum": ["H", "M"]}
          },
          { "name": "longitudCraneo",
            "description": "De la parte trasera del craneo (occipital) a la punta del pico",
            "long_name": "Cranial length",
            "nombre_largo": "Longitud del cráneo",
            "axis": "",
            "standard_name": "",
            "type": "number",
            "units": "mm",
            "constraints": {"minimum": 0.01}
          },
          { "name": "longitudPico",
            "description": "Por la parte frontal del pico, justo desde la linea donde se separan pico y plumas a la punta del pico",
            "long_name": "Beak length",
            "nombre_largo": "Longitud del pico",
            "axis": "",
            "standard_name": "",
            "type": "number",
            "units": "mm",
            "constraints": {"minimum": 0.01}
          },
          { "name": "longitudNarina",
            "description": "De la mitad del orificio de la narina hasta la punta del pico",
            "long_name": "Nare length",
            "nombre_largo": "Longitud de la narina",
            "axis": "",
            "standard_name": "",
            "type": "number",
            "units": "mm",
            "constraints": {"minimum": 0.01}
          },
          { "name": "anchoCraneo",
            "description": "De lado a lado por la parte trasera de los ojos",
            "long_name": "Cranial width",
            "nombre_largo": "Ancho del cráneo",
            "axis": "",
            "standard_name": "",
            "type": "number",
            "units": "mm",
            "constraints": {"minimum": 0.01}
          },
          { "name": "altoPico",
            "description": "De la parte inferior del pico (dentario) a la altura de la narina",
            "long_name": "Beak height",
            "nombre_largo": "Alto del pico",
            "axis": "",
            "standard_name": "",
            "type": "number",
            "units": "mm",
            "constraints": {"minimum": 0.01}
          },
          { "name": "anchoPico",
            "description": "El ancho del pico justo a la altura de la narina",
            "long_name": "Beak width",
            "nombre_largo": "Ancho del pico",
            "axis": "",
            "standard_name": "",
            "type": "number",
            "units": "mm",
            "constraints": {"minimum": 0.01}
          },
          { "name": "tarso",
            "description": "Desde la coyuntura donde se une el metatarso con el peroné a la unión de las falanges con el metatarso",
            "long_name": "Tarsus length",
            "nombre_largo": "Longitud del tarso",
            "axis": "",
            "standard_name": "",
            "type": "number",
            "units": "mm",
            "constraints": {"minimum": 0.01}
          },
          { "name": "longAlaCerrada",
            "description": "Colocando el individuo en posición natural (de descanso). De el radial a la última punta de la pluma de las primarias (P9)",
            "long_name": "Closed wing length",
            "nombre_largo": "Longitud del ala cerrada",
            "axis": "",
            "standard_name": "",
            "type": "number",
            "units": "cm",
            "constraints": {"minimum": 0.01}
          },
          { "name": "longAlaAbierta",
            "description": "De la cabeza del húmero por la parte interna, a la última punta de la pluma de las primarias (P9)",
            "long_name": "Opened wing length",
            "nombre_largo": "Longitud del ala abierta",
            "axis": "",
            "standard_name": "",
            "type": "number",
            "units": "cm",
            "constraints": {"minimum": 0.01}
          },
          { "name": "mediaEnvergadura",
            "description": "Con el ala abierta. De la columna vertebral a la última punta de la pluma de las primarias (P9)",
            "long_name": "Half wingspan length",
            "nombre_largo": "Longitud de la media envergadura",
            "axis": "",
            "standard_name": "",
            "type": "number",
            "units": "cm",
            "constraints": {"minimum": 0.01}
          },
          { "name": "envergadura",
            "description": "Se obtiene a partir de la media envergadura, siendo el doble de esta",
            "long_name": "Wingspan length",
            "nombre_largo": "Longitud de la envergadura",
            "axis": "",
            "standard_name": "",
            "type": "number",
            "units": "cm",
            "constraints": {"minimum": 0.01}
          },
          { "name": "peso",
            "description": "Medida de la masa del individuo",
            "long_name": "Weight",
            "nombre_largo": "Peso",
            "axis": "",
            "standard_name": "",
            "type": "number",
            "units": "kg",
            "constraints": {"minimum": 0.01}
          }
        ],
        "missingValues": [
            "NA"
      
        ]
      }
    }
  ]
}
